{
  "$schema": "https://json-schema.org/draft/2020-12/schema",
  "title": "data/actors/<id>.json",
  "description": "One actor's profile. Every value names the source that asserted it, and disagreements are kept as conflicts rather than resolved. Evidence-only sources never appear here.",
  "type": "object",
  "additionalProperties": false,
  "required": [
    "id",
    "name",
    "aliases",
    "origin",
    "sponsor",
    "motivation",
    "claimed_targets",
    "malware",
    "techniques_documented",
    "techniques_reported",
    "cves",
    "timeline",
    "reports",
    "conflicts",
    "evidence_count"
  ],
  "properties": {
    "id": {
      "$ref": "#/$defs/actorId"
    },
    "name": {
      "$ref": "#/$defs/label",
      "description": "The same display name as in actors/index.json."
    },
    "aliases": {
      "description": "Every published alias with the sources that assert it, display name included.",
      "type": "array",
      "items": {
        "$ref": "#/$defs/aliasClaim"
      }
    },
    "origin": {
      "description": "Where each source says the actor operates from. Upper-case ISO 3166-1 alpha-2 where the source gives a code, otherwise the source's wording.",
      "type": "array",
      "items": {
        "$ref": "#/$defs/sourcedValue"
      }
    },
    "sponsor": {
      "description": "The suspected state sponsor, per source.",
      "type": "array",
      "items": {
        "$ref": "#/$defs/sourcedValue"
      }
    },
    "motivation": {
      "description": "The stated motivation, per source.",
      "type": "array",
      "items": {
        "$ref": "#/$defs/sourcedValue"
      }
    },
    "claimed_targets": {
      "$ref": "#/$defs/claimedTargets"
    },
    "malware": {
      "description": "Malware and tools the sources link to the actor.",
      "type": "array",
      "items": {
        "$ref": "#/$defs/malwareClaim"
      }
    },
    "techniques_documented": {
      "description": "Techniques ATT&CK documents for the actor.",
      "type": "array",
      "items": {
        "$ref": "#/$defs/techniqueId"
      },
      "uniqueItems": true
    },
    "techniques_reported": {
      "description": "Techniques found in reports on this actor published within the trends window (the trailing 24 months, in whole quarters), with how many of those reports name each.",
      "type": "array",
      "items": {
        "$ref": "#/$defs/techniqueCount"
      }
    },
    "cves": {
      "description": "CVEs named in any report on this actor, with their KEV status.",
      "type": "array",
      "items": {
        "$ref": "#/$defs/actorCve"
      }
    },
    "timeline": {
      "description": "Dated reports per quarter, oldest first. Only quarters with at least one report appear, so the site fills the gaps. Undated reports are not counted.",
      "type": "array",
      "items": {
        "$ref": "#/$defs/timelinePoint"
      }
    },
    "reports": {
      "description": "Every published report tagged with this actor, newest first and undated reports last. Empty for an actor with no reports.",
      "type": "array",
      "items": {
        "$ref": "#/$defs/reportId"
      },
      "uniqueItems": true
    },
    "conflicts": {
      "description": "Fields on which published sources disagree.",
      "type": "array",
      "items": {
        "$ref": "#/$defs/conflict"
      }
    },
    "evidence_count": {
      "$ref": "#/$defs/count",
      "description": "Shared-alias evidence edges behind this actor's merge. Edges from evidence-only sources are counted here but never named."
    }
  },
  "$defs": {
    "aliasClaim": {
      "description": "One alias and every published source that asserts it.",
      "type": "object",
      "additionalProperties": false,
      "required": [
        "value",
        "sources"
      ],
      "properties": {
        "value": {
          "$ref": "#/$defs/label"
        },
        "sources": {
          "type": "array",
          "items": {
            "$ref": "#/$defs/sourceKey"
          },
          "uniqueItems": true,
          "minItems": 1
        }
      }
    },
    "sourcedValue": {
      "description": "One value and the source that asserts it.",
      "type": "object",
      "additionalProperties": false,
      "required": [
        "value",
        "source"
      ],
      "properties": {
        "value": {
          "$ref": "#/$defs/label"
        },
        "source": {
          "$ref": "#/$defs/sourceKey"
        }
      }
    },
    "claimedTargets": {
      "description": "Countries and sectors the sources say the actor targets. These are actor-level claims, not facts about any one campaign.",
      "type": "object",
      "additionalProperties": false,
      "required": [
        "countries",
        "sectors"
      ],
      "properties": {
        "countries": {
          "type": "array",
          "items": {
            "$ref": "#/$defs/sourcedValue"
          }
        },
        "sectors": {
          "type": "array",
          "items": {
            "$ref": "#/$defs/sourcedValue"
          }
        }
      }
    },
    "malwareClaim": {
      "description": "A malware family or tool and the source that links it to the actor.",
      "type": "object",
      "additionalProperties": false,
      "required": [
        "name",
        "source"
      ],
      "properties": {
        "name": {
          "$ref": "#/$defs/label"
        },
        "source": {
          "$ref": "#/$defs/sourceKey"
        }
      }
    },
    "techniqueCount": {
      "type": "object",
      "additionalProperties": false,
      "required": [
        "id",
        "count"
      ],
      "properties": {
        "id": {
          "$ref": "#/$defs/techniqueId"
        },
        "count": {
          "$ref": "#/$defs/positiveCount"
        }
      }
    },
    "actorCve": {
      "type": "object",
      "additionalProperties": false,
      "required": [
        "cve",
        "kev",
        "ransomware"
      ],
      "properties": {
        "cve": {
          "$ref": "#/$defs/cve"
        },
        "kev": {
          "description": "True when the CVE is in the CISA KEV catalogue.",
          "type": "boolean"
        },
        "ransomware": {
          "description": "KEV's known-ransomware flag, or null when the CVE is not in KEV.",
          "type": [
            "boolean",
            "null"
          ]
        }
      }
    },
    "timelinePoint": {
      "type": "object",
      "additionalProperties": false,
      "required": [
        "quarter",
        "count"
      ],
      "properties": {
        "quarter": {
          "$ref": "#/$defs/quarter"
        },
        "count": {
          "$ref": "#/$defs/positiveCount"
        }
      }
    },
    "conflict": {
      "description": "A field where published sources disagree. Every side is shown; none is picked.",
      "type": "object",
      "additionalProperties": false,
      "required": [
        "field",
        "values"
      ],
      "properties": {
        "field": {
          "description": "The actor field the sources disagree on.",
          "enum": [
            "origin",
            "sponsor",
            "motivation"
          ]
        },
        "values": {
          "description": "Every published value, each with its source.",
          "type": "array",
          "items": {
            "$ref": "#/$defs/sourcedValue"
          },
          "uniqueItems": true,
          "minItems": 2
        }
      }
    },
    "actorId": {
      "description": "An ATT&CK group ID such as G0007, or a lower-case ASCII slug for an actor ATT&CK does not track. The ID is also the actor's file name and URL segment, so it has no colons, slashes or spaces, and it is never 'index'.",
      "type": "string",
      "pattern": "^(?!index$)(G[0-9]{4}|[a-z0-9]+(-[a-z0-9]+)*)$"
    },
    "count": {
      "type": "integer",
      "minimum": 0
    },
    "cve": {
      "description": "A CVE ID in upper case.",
      "type": "string",
      "pattern": "^CVE-[0-9]{4}-[0-9]{4,7}$"
    },
    "label": {
      "description": "Non-empty text with no leading or trailing whitespace and no line breaks.",
      "type": "string",
      "pattern": "^\\S(.*\\S)?$"
    },
    "positiveCount": {
      "type": "integer",
      "minimum": 1
    },
    "quarter": {
      "description": "A calendar quarter, YYYY-Qn.",
      "type": "string",
      "pattern": "^(199[0-9]|2[0-9]{3})-Q[1-4]$"
    },
    "reportId": {
      "description": "The report's SHA-1 in lower-case hex when one is known, otherwise <source>:<source_id>.",
      "type": "string",
      "pattern": "^([0-9a-f]{40}|[a-z][a-z0-9-]*:\\S+)$"
    },
    "sourceKey": {
      "description": "A connector key such as attack or misp, as listed in sources.json. Never a display name.",
      "type": "string",
      "pattern": "^[a-z][a-z0-9-]*$"
    },
    "techniqueId": {
      "description": "An ATT&CK technique or sub-technique ID.",
      "type": "string",
      "pattern": "^T[0-9]{4}(\\.[0-9]{3})?$"
    }
  }
}
