{
  "id": "storm-2470",
  "name": "Storm-2470",
  "aliases": [
    {
      "value": "Storm-2470",
      "sources": [
        "microsoft"
      ]
    }
  ],
  "origin": [
    {
      "value": "CN",
      "source": "microsoft"
    }
  ],
  "sponsor": [],
  "motivation": [],
  "claimed_targets": {
    "countries": [],
    "sectors": []
  },
  "malware": [],
  "techniques_documented": [],
  "techniques_reported": [],
  "cves": [],
  "timeline": [],
  "reports": [],
  "conflicts": [],
  "evidence_count": 0
}
