{
  "id": "ghost-blizzard",
  "name": "Ghost Blizzard",
  "aliases": [
    {
      "value": "Ghost Blizzard",
      "sources": [
        "microsoft"
      ]
    },
    {
      "value": "BROMINE",
      "sources": [
        "microsoft"
      ]
    },
    {
      "value": "BERSERK BEAR",
      "sources": [
        "microsoft"
      ]
    },
    {
      "value": "TG-4192",
      "sources": [
        "microsoft"
      ]
    },
    {
      "value": "Koala Team",
      "sources": [
        "microsoft"
      ]
    },
    {
      "value": "Blue Kraken",
      "sources": [
        "microsoft"
      ]
    },
    {
      "value": "Crouching Yeti",
      "sources": [
        "microsoft"
      ]
    },
    {
      "value": "Dragonfly",
      "sources": [
        "microsoft"
      ]
    }
  ],
  "origin": [
    {
      "value": "RU",
      "source": "microsoft"
    }
  ],
  "sponsor": [],
  "motivation": [],
  "claimed_targets": {
    "countries": [],
    "sectors": []
  },
  "malware": [],
  "techniques_documented": [],
  "techniques_reported": [],
  "cves": [],
  "timeline": [],
  "reports": [],
  "conflicts": [],
  "evidence_count": 0
}
