{
  "id": "wip19",
  "name": "WIP19",
  "aliases": [
    {
      "value": "WIP19",
      "sources": [
        "misp",
        "malpedia"
      ]
    }
  ],
  "origin": [
    {
      "value": "CN",
      "source": "misp"
    },
    {
      "value": "CN",
      "source": "malpedia"
    }
  ],
  "sponsor": [],
  "motivation": [],
  "claimed_targets": {
    "countries": [],
    "sectors": []
  },
  "malware": [],
  "techniques_documented": [],
  "techniques_reported": [],
  "cves": [],
  "timeline": [],
  "reports": [],
  "conflicts": [],
  "evidence_count": 1
}
