{
  "id": "operation-manul",
  "name": "Operation Manul",
  "aliases": [
    {
      "value": "Operation Manul",
      "sources": [
        "etda"
      ]
    }
  ],
  "origin": [
    {
      "value": "KZ",
      "source": "etda"
    }
  ],
  "sponsor": [],
  "motivation": [
    {
      "value": "Information theft and espionage",
      "source": "etda"
    }
  ],
  "claimed_targets": {
    "countries": [],
    "sectors": [
      {
        "value": "journalists and dissidents",
        "source": "etda"
      }
    ]
  },
  "malware": [],
  "techniques_documented": [],
  "techniques_reported": [],
  "cves": [],
  "timeline": [
    {
      "quarter": "2016-Q3",
      "count": 1
    }
  ],
  "reports": [
    "paper:EFF_OperationManul(08-03-2016)"
  ],
  "conflicts": [],
  "evidence_count": 0
}
