{
  "id": "ruby-sleet",
  "name": "Ruby Sleet",
  "aliases": [
    {
      "value": "Ruby Sleet",
      "sources": [
        "malpedia"
      ]
    },
    {
      "value": "CERIUM",
      "sources": [
        "malpedia"
      ]
    }
  ],
  "origin": [
    {
      "value": "KP",
      "source": "malpedia"
    }
  ],
  "sponsor": [],
  "motivation": [],
  "claimed_targets": {
    "countries": [],
    "sectors": []
  },
  "malware": [],
  "techniques_documented": [],
  "techniques_reported": [],
  "cves": [],
  "timeline": [],
  "reports": [],
  "conflicts": [],
  "evidence_count": 0
}
