{
  "id": "storm-1044",
  "name": "Storm-1044",
  "aliases": [
    {
      "value": "Storm-1044",
      "sources": [
        "misp",
        "malpedia"
      ]
    },
    {
      "value": "DEV-1044",
      "sources": [
        "misp",
        "malpedia"
      ]
    }
  ],
  "origin": [],
  "sponsor": [],
  "motivation": [],
  "claimed_targets": {
    "countries": [],
    "sectors": []
  },
  "malware": [],
  "techniques_documented": [],
  "techniques_reported": [],
  "cves": [],
  "timeline": [],
  "reports": [],
  "conflicts": [],
  "evidence_count": 2
}
