{
  "id": "unk-sparkycarp",
  "name": "UNK_SparkyCarp",
  "aliases": [
    {
      "value": "UNK_SparkyCarp",
      "sources": [
        "misp",
        "malpedia"
      ]
    }
  ],
  "origin": [],
  "sponsor": [],
  "motivation": [],
  "claimed_targets": {
    "countries": [],
    "sectors": []
  },
  "malware": [],
  "techniques_documented": [],
  "techniques_reported": [],
  "cves": [],
  "timeline": [],
  "reports": [],
  "conflicts": [],
  "evidence_count": 1
}
