{
  "id": "darkgaboon",
  "name": "DarkGaboon",
  "aliases": [
    {
      "value": "DarkGaboon",
      "sources": [
        "misp",
        "malpedia"
      ]
    },
    {
      "value": "Vengeful Wolf",
      "sources": [
        "misp",
        "malpedia"
      ]
    },
    {
      "value": "room155",
      "sources": [
        "misp",
        "malpedia"
      ]
    }
  ],
  "origin": [],
  "sponsor": [],
  "motivation": [],
  "claimed_targets": {
    "countries": [],
    "sectors": []
  },
  "malware": [],
  "techniques_documented": [],
  "techniques_reported": [],
  "cves": [],
  "timeline": [
    {
      "quarter": "2025-Q1",
      "count": 1
    }
  ],
  "reports": [
    "558f5a37d7ec0de7dcebe7e44ecf2143011d0424"
  ],
  "conflicts": [],
  "evidence_count": 3
}
