{
  "id": "patched-lightning",
  "name": "Patched Lightning",
  "aliases": [
    {
      "value": "Patched Lightning",
      "sources": [
        "misp",
        "malpedia",
        "microsoft"
      ]
    },
    {
      "value": "Storm-0113",
      "sources": [
        "misp",
        "malpedia",
        "microsoft"
      ]
    }
  ],
  "origin": [],
  "sponsor": [],
  "motivation": [],
  "claimed_targets": {
    "countries": [],
    "sectors": []
  },
  "malware": [],
  "techniques_documented": [],
  "techniques_reported": [],
  "cves": [],
  "timeline": [],
  "reports": [],
  "conflicts": [],
  "evidence_count": 4
}
