{
  "id": "tomiris",
  "name": "Tomiris",
  "aliases": [
    {
      "value": "Tomiris",
      "sources": [
        "etda"
      ]
    }
  ],
  "origin": [],
  "sponsor": [],
  "motivation": [
    {
      "value": "Information theft and espionage",
      "source": "etda"
    }
  ],
  "claimed_targets": {
    "countries": [],
    "sectors": [
      {
        "value": "Government",
        "source": "etda"
      }
    ]
  },
  "malware": [],
  "techniques_documented": [],
  "techniques_reported": [],
  "cves": [],
  "timeline": [],
  "reports": [],
  "conflicts": [],
  "evidence_count": 0
}
