{
  "id": "cosmic-lynx",
  "name": "Cosmic Lynx",
  "aliases": [
    {
      "value": "Cosmic Lynx",
      "sources": [
        "misp",
        "malpedia"
      ]
    }
  ],
  "origin": [],
  "sponsor": [],
  "motivation": [],
  "claimed_targets": {
    "countries": [],
    "sectors": []
  },
  "malware": [],
  "techniques_documented": [],
  "techniques_reported": [],
  "cves": [],
  "timeline": [
    {
      "quarter": "2020-Q3",
      "count": 2
    },
    {
      "quarter": "2021-Q1",
      "count": 1
    }
  ],
  "reports": [
    "b32963be4f525467eb9118cc47bd846761ab1504",
    "60542b63d4ebd6481f237c64553920cb3ee53897",
    "ba4b3e026ffca004e921f12597aacdb38f66e29f"
  ],
  "conflicts": [],
  "evidence_count": 1
}
