{
  "id": "nighteagle",
  "name": "NightEagle",
  "aliases": [
    {
      "value": "NightEagle",
      "sources": [
        "misp",
        "malpedia"
      ]
    },
    {
      "value": "APT-Q-95",
      "sources": [
        "misp",
        "malpedia"
      ]
    }
  ],
  "origin": [
    {
      "value": "US",
      "source": "misp"
    },
    {
      "value": "US",
      "source": "malpedia"
    }
  ],
  "sponsor": [],
  "motivation": [],
  "claimed_targets": {
    "countries": [],
    "sectors": [
      {
        "value": "Military",
        "source": "misp"
      },
      {
        "value": "Government, Administration",
        "source": "misp"
      },
      {
        "value": "Technology",
        "source": "misp"
      },
      {
        "value": "Military",
        "source": "malpedia"
      },
      {
        "value": "Government, Administration",
        "source": "malpedia"
      },
      {
        "value": "Technology",
        "source": "malpedia"
      }
    ]
  },
  "malware": [],
  "techniques_documented": [],
  "techniques_reported": [],
  "cves": [],
  "timeline": [],
  "reports": [],
  "conflicts": [],
  "evidence_count": 2
}
