{
  "id": "operation-shadowhammer",
  "name": "Operation ShadowHammer",
  "aliases": [
    {
      "value": "Operation ShadowHammer",
      "sources": [
        "misp",
        "malpedia"
      ]
    }
  ],
  "origin": [],
  "sponsor": [],
  "motivation": [],
  "claimed_targets": {
    "countries": [],
    "sectors": []
  },
  "malware": [
    {
      "name": "shadowhammer",
      "source": "malpedia"
    }
  ],
  "techniques_documented": [],
  "techniques_reported": [],
  "cves": [
    {
      "cve": "CVE-2008-3431",
      "kev": true,
      "ransomware": false
    },
    {
      "cve": "CVE-2019-10149",
      "kev": true,
      "ransomware": false
    },
    {
      "cve": "CVE-2020-0688",
      "kev": true,
      "ransomware": true
    }
  ],
  "timeline": [
    {
      "quarter": "2019-Q1",
      "count": 4
    },
    {
      "quarter": "2019-Q2",
      "count": 3
    },
    {
      "quarter": "2020-Q1",
      "count": 2
    },
    {
      "quarter": "2020-Q3",
      "count": 1
    }
  ],
  "reports": [
    "75ce802fc0723328a492651833c43e1f274c4a87",
    "85411fe473183c377bef5ec52815e10ff0026626",
    "24b089f66141a590b8d2b32cff928f14e3a0d550",
    "d244fb95c84cc481e8c1313e7462625b22cf346c",
    "4a55053fb7fabe3d473418c96d93f087e9dd20d5",
    "ece7e007e71df2343d9fe0546daa543a4a75cf8d",
    "e6756795670c11bfc503016b2e4b5ed7135b37bb",
    "b250eceb39b35c5377c1f25c653776f7cc538c0e",
    "d8ca889dd6d282001d49b474535689d83e1de167",
    "5649069a74bf22614de960ea09d194771721e989"
  ],
  "conflicts": [],
  "evidence_count": 1
}
